{"formatVersion":1,"profile":"unicode16-extended-graphemes-v1","unicodeVersion":"16.0.0","algorithm":"uax29-45-extended","license":{"path":"resources/unicode16/LICENSE.txt","url":"https://www.unicode.org/license.txt","sha256":"e7a93b009565cfce55919a381437ac4db883e9da2126fa28b91d12732bc53d96"},"sources":{"GraphemeBreakProperty.txt":{"url":"https://www.unicode.org/Public/16.0.0/ucd/auxiliary/GraphemeBreakProperty.txt","sha256":"c29360bd6f7132811d701d29069541e827eb44bfc4c8fbde8c370d6982689dc1"},"emoji-data.txt":{"url":"https://www.unicode.org/Public/16.0.0/ucd/emoji/emoji-data.txt","sha256":"f1365a5173eee18e1f98b240cdc492e84a25f1ce7e0c9d1094eb29c41a22696a"},"DerivedCoreProperties.txt":{"url":"https://www.unicode.org/Public/16.0.0/ucd/DerivedCoreProperties.txt","sha256":"39d35161f2954497f69e08bdb9e701493f476a3d30222de20028feda36c1dabd"},"GraphemeBreakTest.txt":{"url":"https://www.unicode.org/Public/16.0.0/ucd/auxiliary/GraphemeBreakTest.txt","sha256":"ee2b9354d270ac061b29f09662cafea06341d77e704b8cc6bd72aaeeda363cb5"}},"graphemeBreakRanges":[[0,9,"Control"],[10,10,"LF"],[11,12,"Control"],[13,13,"CR"],[14,31,"Control"],[127,159,"Control"],[173,173,"Control"],[768,879,"Extend"],[1155,1161,"Extend"],[1425,1469,"Extend"],[1471,1471,"Extend"],[1473,1474,"Extend"],[1476,1477,"Extend"],[1479,1479,"Extend"],[1536,1541,"Prepend"],[1552,1562,"Extend"],[1564,1564,"Control"],[1611,1631,"Extend"],[1648,1648,"Extend"],[1750,1756,"Extend"],[1757,1757,"Prepend"],[1759,1764,"Extend"],[1767,1768,"Extend"],[1770,1773,"Extend"],[1807,1807,"Prepend"],[1809,1809,"Extend"],[1840,1866,"Extend"],[1958,1968,"Extend"],[2027,2035,"Extend"],[2045,2045,"Extend"],[2070,2073,"Extend"],[2075,2083,"Extend"],[2085,2087,"Extend"],[2089,2093,"Extend"],[2137,2139,"Extend"],[2192,2193,"Prepend"],[2199,2207,"Extend"],[2250,2273,"Extend"],[2274,2274,"Prepend"],[2275,2306,"Extend"],[2307,2307,"SpacingMark"],[2362,2362,"Extend"],[2363,2363,"SpacingMark"],[2364,2364,"Extend"],[2366,2368,"SpacingMark"],[2369,2376,"Extend"],[2377,2380,"SpacingMark"],[2381,2381,"Extend"],[2382,2383,"SpacingMark"],[2385,2391,"Extend"],[2402,2403,"Extend"],[2433,2433,"Extend"],[2434,2435,"SpacingMark"],[2492,2492,"Extend"],[2494,2494,"Extend"],[2495,2496,"SpacingMark"],[2497,2500,"Extend"],[2503,2504,"SpacingMark"],[2507,2508,"SpacingMark"],[2509,2509,"Extend"],[2519,2519,"Extend"],[2530,2531,"Extend"],[2558,2558,"Extend"],[2561,2562,"Extend"],[2563,2563,"SpacingMark"],[2620,2620,"Extend"],[2622,2624,"SpacingMark"],[2625,2626,"Extend"],[2631,2632,"Extend"],[2635,2637,"Extend"],[2641,2641,"Extend"],[2672,2673,"Extend"],[2677,2677,"Extend"],[2689,2690,"Extend"],[2691,2691,"SpacingMark"],[2748,2748,"Extend"],[2750,2752,"SpacingMark"],[2753,2757,"Extend"],[2759,2760,"Extend"],[2761,2761,"SpacingMark"],[2763,2764,"SpacingMark"],[2765,2765,"Extend"],[2786,2787,"Extend"],[2810,2815,"Extend"],[2817,2817,"Extend"],[2818,2819,"SpacingMark"],[2876,2876,"Extend"],[2878,2879,"Extend"],[2880,2880,"SpacingMark"],[2881,2884,"Extend"],[2887,2888,"SpacingMark"],[2891,2892,"SpacingMark"],[2893,2893,"Extend"],[2901,2903,"Extend"],[2914,2915,"Extend"],[2946,2946,"Extend"],[3006,3006,"Extend"],[3007,3007,"SpacingMark"],[3008,3008,"Extend"],[3009,3010,"SpacingMark"],[3014,3016,"SpacingMark"],[3018,3020,"SpacingMark"],[3021,3021,"Extend"],[3031,3031,"Extend"],[3072,3072,"Extend"],[3073,3075,"SpacingMark"],[3076,3076,"Extend"],[3132,3132,"Extend"],[3134,3136,"Extend"],[3137,3140,"SpacingMark"],[3142,3144,"Extend"],[3146,3149,"Extend"],[3157,3158,"Extend"],[3170,3171,"Extend"],[3201,3201,"Extend"],[3202,3203,"SpacingMark"],[3260,3260,"Extend"],[3262,3262,"SpacingMark"],[3263,3264,"Extend"],[3265,3265,"SpacingMark"],[3266,3266,"Extend"],[3267,3268,"SpacingMark"],[3270,3272,"Extend"],[3274,3277,"Extend"],[3285,3286,"Extend"],[3298,3299,"Extend"],[3315,3315,"SpacingMark"],[3328,3329,"Extend"],[3330,3331,"SpacingMark"],[3387,3388,"Extend"],[3390,3390,"Extend"],[3391,3392,"SpacingMark"],[3393,3396,"Extend"],[3398,3400,"SpacingMark"],[3402,3404,"SpacingMark"],[3405,3405,"Extend"],[3406,3406,"Prepend"],[3415,3415,"Extend"],[3426,3427,"Extend"],[3457,3457,"Extend"],[3458,3459,"SpacingMark"],[3530,3530,"Extend"],[3535,3535,"Extend"],[3536,3537,"SpacingMark"],[3538,3540,"Extend"],[3542,3542,"Extend"],[3544,3550,"SpacingMark"],[3551,3551,"Extend"],[3570,3571,"SpacingMark"],[3633,3633,"Extend"],[3635,3635,"SpacingMark"],[3636,3642,"Extend"],[3655,3662,"Extend"],[3761,3761,"Extend"],[3763,3763,"SpacingMark"],[3764,3772,"Extend"],[3784,3790,"Extend"],[3864,3865,"Extend"],[3893,3893,"Extend"],[3895,3895,"Extend"],[3897,3897,"Extend"],[3902,3903,"SpacingMark"],[3953,3966,"Extend"],[3967,3967,"SpacingMark"],[3968,3972,"Extend"],[3974,3975,"Extend"],[3981,3991,"Extend"],[3993,4028,"Extend"],[4038,4038,"Extend"],[4141,4144,"Extend"],[4145,4145,"SpacingMark"],[4146,4151,"Extend"],[4153,4154,"Extend"],[4155,4156,"SpacingMark"],[4157,4158,"Extend"],[4182,4183,"SpacingMark"],[4184,4185,"Extend"],[4190,4192,"Extend"],[4209,4212,"Extend"],[4226,4226,"Extend"],[4228,4228,"SpacingMark"],[4229,4230,"Extend"],[4237,4237,"Extend"],[4253,4253,"Extend"],[4352,4447,"L"],[4448,4519,"V"],[4520,4607,"T"],[4957,4959,"Extend"],[5906,5909,"Extend"],[5938,5940,"Extend"],[5970,5971,"Extend"],[6002,6003,"Extend"],[6068,6069,"Extend"],[6070,6070,"SpacingMark"],[6071,6077,"Extend"],[6078,6085,"SpacingMark"],[6086,6086,"Extend"],[6087,6088,"SpacingMark"],[6089,6099,"Extend"],[6109,6109,"Extend"],[6155,6157,"Extend"],[6158,6158,"Control"],[6159,6159,"Extend"],[6277,6278,"Extend"],[6313,6313,"Extend"],[6432,6434,"Extend"],[6435,6438,"SpacingMark"],[6439,6440,"Extend"],[6441,6443,"SpacingMark"],[6448,6449,"SpacingMark"],[6450,6450,"Extend"],[6451,6456,"SpacingMark"],[6457,6459,"Extend"],[6679,6680,"Extend"],[6681,6682,"SpacingMark"],[6683,6683,"Extend"],[6741,6741,"SpacingMark"],[6742,6742,"Extend"],[6743,6743,"SpacingMark"],[6744,6750,"Extend"],[6752,6752,"Extend"],[6754,6754,"Extend"],[6757,6764,"Extend"],[6765,6770,"SpacingMark"],[6771,6780,"Extend"],[6783,6783,"Extend"],[6832,6862,"Extend"],[6912,6915,"Extend"],[6916,6916,"SpacingMark"],[6964,6973,"Extend"],[6974,6977,"SpacingMark"],[6978,6980,"Extend"],[7019,7027,"Extend"],[7040,7041,"Extend"],[7042,7042,"SpacingMark"],[7073,7073,"SpacingMark"],[7074,7077,"Extend"],[7078,7079,"SpacingMark"],[7080,7085,"Extend"],[7142,7142,"Extend"],[7143,7143,"SpacingMark"],[7144,7145,"Extend"],[7146,7148,"SpacingMark"],[7149,7149,"Extend"],[7150,7150,"SpacingMark"],[7151,7155,"Extend"],[7204,7211,"SpacingMark"],[7212,7219,"Extend"],[7220,7221,"SpacingMark"],[7222,7223,"Extend"],[7376,7378,"Extend"],[7380,7392,"Extend"],[7393,7393,"SpacingMark"],[7394,7400,"Extend"],[7405,7405,"Extend"],[7412,7412,"Extend"],[7415,7415,"SpacingMark"],[7416,7417,"Extend"],[7616,7679,"Extend"],[8203,8203,"Control"],[8204,8204,"Extend"],[8205,8205,"ZWJ"],[8206,8207,"Control"],[8232,8238,"Control"],[8288,8303,"Control"],[8400,8432,"Extend"],[11503,11505,"Extend"],[11647,11647,"Extend"],[11744,11775,"Extend"],[12330,12335,"Extend"],[12441,12442,"Extend"],[42607,42610,"Extend"],[42612,42621,"Extend"],[42654,42655,"Extend"],[42736,42737,"Extend"],[43010,43010,"Extend"],[43014,43014,"Extend"],[43019,43019,"Extend"],[43043,43044,"SpacingMark"],[43045,43046,"Extend"],[43047,43047,"SpacingMark"],[43052,43052,"Extend"],[43136,43137,"SpacingMark"],[43188,43203,"SpacingMark"],[43204,43205,"Extend"],[43232,43249,"Extend"],[43263,43263,"Extend"],[43302,43309,"Extend"],[43335,43345,"Extend"],[43346,43346,"SpacingMark"],[43347,43347,"Extend"],[43360,43388,"L"],[43392,43394,"Extend"],[43395,43395,"SpacingMark"],[43443,43443,"Extend"],[43444,43445,"SpacingMark"],[43446,43449,"Extend"],[43450,43451,"SpacingMark"],[43452,43453,"Extend"],[43454,43455,"SpacingMark"],[43456,43456,"Extend"],[43493,43493,"Extend"],[43561,43566,"Extend"],[43567,43568,"SpacingMark"],[43569,43570,"Extend"],[43571,43572,"SpacingMark"],[43573,43574,"Extend"],[43587,43587,"Extend"],[43596,43596,"Extend"],[43597,43597,"SpacingMark"],[43644,43644,"Extend"],[43696,43696,"Extend"],[43698,43700,"Extend"],[43703,43704,"Extend"],[43710,43711,"Extend"],[43713,43713,"Extend"],[43755,43755,"SpacingMark"],[43756,43757,"Extend"],[43758,43759,"SpacingMark"],[43765,43765,"SpacingMark"],[43766,43766,"Extend"],[44003,44004,"SpacingMark"],[44005,44005,"Extend"],[44006,44007,"SpacingMark"],[44008,44008,"Extend"],[44009,44010,"SpacingMark"],[44012,44012,"SpacingMark"],[44013,44013,"Extend"],[44032,44032,"LV"],[44033,44059,"LVT"],[44060,44060,"LV"],[44061,44087,"LVT"],[44088,44088,"LV"],[44089,44115,"LVT"],[44116,44116,"LV"],[44117,44143,"LVT"],[44144,44144,"LV"],[44145,44171,"LVT"],[44172,44172,"LV"],[44173,44199,"LVT"],[44200,44200,"LV"],[44201,44227,"LVT"],[44228,44228,"LV"],[44229,44255,"LVT"],[44256,44256,"LV"],[44257,44283,"LVT"],[44284,44284,"LV"],[44285,44311,"LVT"],[44312,44312,"LV"],[44313,44339,"LVT"],[44340,44340,"LV"],[44341,44367,"LVT"],[44368,44368,"LV"],[44369,44395,"LVT"],[44396,44396,"LV"],[44397,44423,"LVT"],[44424,44424,"LV"],[44425,44451,"LVT"],[44452,44452,"LV"],[44453,44479,"LVT"],[44480,44480,"LV"],[44481,44507,"LVT"],[44508,44508,"LV"],[44509,44535,"LVT"],[44536,44536,"LV"],[44537,44563,"LVT"],[44564,44564,"LV"],[44565,44591,"LVT"],[44592,44592,"LV"],[44593,44619,"LVT"],[44620,44620,"LV"],[44621,44647,"LVT"],[44648,44648,"LV"],[44649,44675,"LVT"],[44676,44676,"LV"],[44677,44703,"LVT"],[44704,44704,"LV"],[44705,44731,"LVT"],[44732,44732,"LV"],[44733,44759,"LVT"],[44760,44760,"LV"],[44761,44787,"LVT"],[44788,44788,"LV"],[44789,44815,"LVT"],[44816,44816,"LV"],[44817,44843,"LVT"],[44844,44844,"LV"],[44845,44871,"LVT"],[44872,44872,"LV"],[44873,44899,"LVT"],[44900,44900,"LV"],[44901,44927,"LVT"],[44928,44928,"LV"],[44929,44955,"LVT"],[44956,44956,"LV"],[44957,44983,"LVT"],[44984,44984,"LV"],[44985,45011,"LVT"],[45012,45012,"LV"],[45013,45039,"LVT"],[45040,45040,"LV"],[45041,45067,"LVT"],[45068,45068,"LV"],[45069,45095,"LVT"],[45096,45096,"LV"],[45097,45123,"LVT"],[45124,45124,"LV